{
  "schemaId": "cd-collab.experiment_summary.v1",
  "packageId": "pkg-synth-three-model-checkout-v1",
  "privacyClass": "share_safe",
  "taskFingerprint": "task-162aec8ca84e72ecfc9164d4168d18b6e41367e7c10e9c23aef086bf83bfd007",
  "snapshotFingerprint": "snap-5a75de4d710765b3fbb87afdc85beb25fd96f23b46ef4c59d416aa7ae61bbceb",
  "candidates": [
    {
      "candidateId": "cand-qwen-3.6-27b",
      "modelLabel": "qwen-3.6-27b",
      "role": "single",
      "runStatus": "completed",
      "observedLatency": { "status": "observed", "milliseconds": 4120 },
      "cost": { "status": "unknown" },
      "usage": { "status": "unknown" },
      "helpfulnessState": "unreviewed",
      "goldState": "unknown"
    },
    {
      "candidateId": "cand-gpt-oss-120b",
      "modelLabel": "gpt-oss-120b",
      "role": "single",
      "runStatus": "completed",
      "observedLatency": { "status": "observed", "milliseconds": 2380 },
      "cost": { "status": "unknown" },
      "usage": { "status": "unknown" },
      "helpfulnessState": "unreviewed",
      "goldState": "unknown"
    },
    {
      "candidateId": "cand-ministral-14b",
      "modelLabel": "ministral-14b",
      "role": "single",
      "runStatus": "completed",
      "observedLatency": { "status": "observed", "milliseconds": 910 },
      "cost": { "status": "unknown" },
      "usage": { "status": "unknown" },
      "helpfulnessState": "unreviewed",
      "goldState": "unknown"
    }
  ],
  "agreement": null
}
